Title,DateTime,Url
Using The JavaScript Ternary Operator Effectively,2020-11-09 00:00:00 UTC,/blog/using-the-javascript-ternary-operator
Seven Tips For Dealing With Imposter Syndrome,2020-10-20 00:00:00 UTC,/blog/dealing-with-coding-bootcamp-imposter-syndrome
Alumni Spotlight: Genna Mergola,2020-10-13 00:00:00 UTC,/blog/alumni-spotlight-genna-mergola
How To Get Into A Top Coding Bootcamp,2020-09-22 00:00:00 UTC,/blog/how-to-get-into-top-coding-bootcamp-rithm-school
Taking Breaks: Why Being Busy Doesn't Equal Productivity,2020-08-18 00:00:00 UTC,/blog/taking-breaks-for-productivity
Student Interview: R16 On Company Projects,2020-08-11 00:00:00 UTC,/blog/student-interview-r16-on-remote-company-projects
5 Topics To Master Before Learning React Hooks,2020-07-28 00:00:00 UTC,/blog/5-topics-to-master-before-learning-react-hooks
What You Can Learn From Learning A New Language,2020-07-21 00:00:00 UTC,/blog/what-you-can-learn-from-learning-a-new-language
Software Engineering Careers Post Covid-19,2020-07-08 00:00:00 UTC,/blog/software-engineering-careers-post-covid-19
What Coding Language You Should Learn To Get Hired In 2020,2020-07-02 00:00:00 UTC,/blog/what-coding-language-you-should-learn-to-get-hired-in-2020
Alumni Spotlight: George Gruner,2020-06-24 00:00:00 UTC,/blog/alumni-spotlight-george-gruner
A Tech Worker Reading List for 2020,2020-06-08 00:00:00 UTC,/blog/tech-worker-reading-list-for-2020
JavaScript in 2020,2020-05-27 00:00:00 UTC,/blog/javascript-in-2020
Rithm's Alumni Mentor Program,2020-05-12 00:00:00 UTC,/blog/bootcamp-alumni-mentorship-program
Rithm School Remote Updates - Scholarships & Smaller Class Sizes,2020-05-06 00:00:00 UTC,/blog/remote-2020-updates-scholarships
Student Interview: R14 On Remote Company Projects,2020-04-29 00:00:00 UTC,/blog/student-interview-remote-company-projects
7 Easy Ways To Focus On The Job Search Process,2020-04-21 00:00:00 UTC,/blog/focus-job-process-during-covid-19
SanFranciscoBootcamps.com - Campus Review – Rithm School San Francisco,2020-04-08 00:00:00 UTC,/blog/san-francisco-coding-bootcamps-review
Rithm School Remote Learning FAQs,2020-04-01 00:00:00 UTC,/blog/remote-learning-faq
Looking Back On Our First Women In Tech Event Series,2020-03-31 00:00:00 UTC,/blog/looking-back-women-in-tech
